CourseID,CourseDescription,CourseTitle,CourseTypeID,Duration,ModifiedOn
1,"In this course you will be introduced to chocolate tempering and chocolate garnishes, colour casting, ganache, molded and hand dipped chocolates.",THE CHOCOLATE LAB,1,12,2017-02-28 13:37:30.0314361
2,"Say Cheese! and bake delectable cheese cake in whitecaps.Baked raspberry cheese cake, Japanese style cheese cake, Philadelphia style caramel cheese cake.",THE CHEESE CAKE,1,12,2017-02-28 13:37:30.0324362
3,"Let’s bake together! Learn different techniques of basic pound cake, carrot cake and banana walnut without losing focus on the creamy, nutty and crunchy delectable tart.",POUND CAKE AND TARTS,1,12,2017-02-28 13:37:30.0324362
4,Superb Cakes by Arving,SUPERB CAKES,1,4,2017-02-28 13:37:30.0000000
5,Master the Pastry,WONDER PASTRY,1,8,2017-02-28 13:37:30.0000000
6,Get it Lost in the Choclates,Yaummy Cakes,1,12,2017-02-28 13:37:30.0000000
